0,4
πανσερραϊκος σημαντικα προβληματα για το ματς στη ροδο,13 11 2009
παπανδρεου γιωργος καλεσμα σε εθνικο διαλογο,22 11 2009
παπαπαναγιωτου κωστας δεν θα ειμαι υποψηφιος νομαρχης,26 11 2009
παραξενη ανακοινωση της καλαματας για το παιχνιδι στις σερρες,04 11 2009
παρελθον απο τον οδυσσεα ο χρυσοστομιδης,14 11 2009
παρουσιαση της νεας τουριστικης καμπανιας του νομου σερρων στο ζαππειο,05 11 2009
παροχη βοηθειας στον ελληνισμο της ιμβρου,07 11 2009
περαιωση του κεντρου εξετασης υποψηφιων οδηγων στις σερρες,12 11 2009
περιφερειακο πρωταθληαμα τοπικο ντερμπι ηρακλειας γεφυρουδιου,07 11 2009
περιφερειακο πρωταθλημα ολοι οι δρομοι οδηγουν στην ηρακλεια,22 11 2009
περιφερειακο πρωταθλημα πρωτοπορος ο ο μεγας αλεξανδρος ηρακλειας,17 11 2009
περιφερειακο πρωταθλημα επικινδυνη εξοδος για την ηρακλεια,14 11 2009
περιφερειακο πρωταθλημα στην κορυφη ο μεγας αλεξανδρος ηρακλειας,03 11 2009
περιφερειακο πρωταθλημα συνεχιζει στην κορυφη η ηρακλεια,10 11 2009
πετυχημενη γενικη συνελευση των σερραιων εστιατορων,22 11 2009
πετυχημενη ενημερωση για την ελια στο σιτοχωρι,14 11 2009
πετυχημενη η 8η συναντηση υπαλληλων συμβολαιογραφων,27 11 2009
πολατιδης ηλιας ερωτηση για τη σφαγη της χιου,25 11 2009
πολατιδης ηλιας ερωτηση για την αυξηση της ανεργιας στην ελλαδα,06 11 2009
πολατιδης ηλιας ερωτηση για το τουρκικο προξενειου κομοτηνης,13 11 2009
πολατιδης ηλιας ερωτηση για την περιοχη ερειπια νεραϊδας,14 11 2009
πολατιδης ηλιας ερωτηση για τον αρχαιολογικο χωρο τερπνης,19 11 2009
πολατιδης ηλις ιδια τακτικη ο υπουργος πολιτισμου με τους προηγουμενους,27 11 2009
πολιτικες για την αναθερμανση της οικονομιας,19 11 2009
πολυτεχνειο 36 χρονια μετα κορυφωση εκδηλωσεων στις σερρες,17 11 2009
πολυτεχνειο 36 χρονια τιμη και σεβασμος στην εξεγερση της νεολαιας,18 11 2009
που θα ψηφισουν οι γαλαζιοι σερραιοι,20 11 2009
πραγματοποιηθηκε η γενικη συνελευση των καθηγητων ν σερρων,27 11 2009
πραγματοποιηθηκε συσκεψη για το νοτιο πεταλο,11 11 2009
πραγματοποιηθηκεη 8η γιορτη τσιπουρου τερπνης στην πλαζ αρετσους,26 11 2009
πρεμιερα στον εμβολιασμο κατα του ιου της νεας γριπης,18 11 2009
προκαλουν οι σκοπιανοι,05 11 2009
προσληψεις στους δημους αλιστρατης και σκουταρεως,22 11 2009
προσληψη 12 ατομων στο δημο εμμανουηλ παπα,18 11 2009
προσληψη επτα ατομων στη να σερρων,26 11 2009
προχωρα η δημιουργια νηπιαγωγειων στην πολη των σερρων,26 11 2009
σαμαρα δημητρα ο καποδιστριας 2 οι διαμαρτυριες και αλλες ιστοριες,25 11 2009
σαμαρα δημητρα το τειχος και τα τειχη,20 11 2009
σαμαρας αβραμοπουλος μαζι,11 11 2009
σαμαρας αντωνης οι τεσσερις πυλωνες του κοινωνικου φιλελευθερισμου,04 11 2009
σαμπανης μιχαλης ομιλητης στο 5ο συνεδριο ιατρικης της αθλησης στον 21ο αιωνα,26 11 2009
σε εξελιξη οι εμβολιασμοι για δευτερη εβδομαδα,24 11 2009
σε θεση μαχης οι υποψηφιοι για την προεδρια της νδ,10 11 2009
σε λειτουργια οι σηματοδοτες στον κομβο ν σουλιου,25 11 2009
σερρα ικα προϊοντα στο 2ο φεστιβαλ γαλακτος στην αθηνα,05 11 2009
σερραιοι στο intelnasional six deys enduro της πορτογαλλιας,18 11 2009
σερραϊκη παρουσια σε διεθνη εκθεση στη σοφια της βουλγαριας,17 11 2009
σερρες και παλι βραβειο στη filoxenia,03 11 2009
σταθερη στην πρωτια της ακριβειας η ελλαδα,24 11 2009
στο δημο ροδολιβους η κινητη μοναδα προληψης γυναικολογικου καρκινου,10 11 2009
συλλογος καρκινοπαθων σερρων εξακολουθει και ζηταει παθολογο ογκολογο,25 11 2009
συμπαρασταση στους κατοικους παλαιοκαστρου και μελενικιτσιου απο τη νε κκε σερρω,04 11 2009
συναντηση μαρκου μπολαρη με σεπβε,05 11 2009
συναντηση του δικτυου διασυνοριακης συνεργασιας ελλαδασ τουρκιασ βουλγαριας,20 11 2009
συναντηση φωτιαδη με νομαρχιακες των κομματων,12 11 2009
συναντηση φωτιαδη με νομαρχιακη επιτροπη συνασπισμου,18 11 2009
συναντηση φωτιαδη με νομαρχιακη του λα.ο.ς,14 11 2009
συνεδριαζει το νομαρχιακο συμβουλιο σερρων την δευτερα,27 11 2009
συνεχιζεται το προγραμμα συμμετεχω,14 11 2009
συσκεψεις μπολαρη με φορεις,24 11 2009
συσκεψη για τα δημητριακα στη νομαρχια,14 11 2009
συσκεψη για την αδειοδοτηση εγκαταστασης φωτοβολταϊκων στοιχειων,12 11 2009
συσκεψη στη νομαρχια για τα προστιμα για δηθεν εικονικα τιμολογια στου τοματοπ,20 11 2009
συσκεψη στην νομαρχια με επαγγελματιες της λιμνης της κερκινης,22 11 2009
συσκεψη του συντονιστικου οργανου της νομαρχιας σερρων,17 11 2009
συσκεψη φορεων για τα κριτηρια διακοπης λειτουργειας των σχολειων,26 11 2009
σχολη ποδοσφαιρου το μαρτη στις σερρες,12 11 2009
σωμα ελληνικου οδηγισμου αγιασμος για τη νεα χρονια,20 11 2009
σωμα ελληνικου οδηγισμου αγιασμος την κυριακη,13 11 2009
τεσσερα επιβεβαιωμενα κρουσματα νεας γριπης στο νομο σερρων,07 11 2009
τζελεπης μιχαλης συναντηση εργασιας με τη δ.ε του επιμελητηριου σερρων,26 11 2009
τζελεπης μιχαλης συναντηση με το δς της συνεταιριστικης τραπεζας σερρων,10 11 2009
τζελεπης μιχαλης να πληρωθουν οι αγροτες τα χρεη που αφησε η νεα δημοκρατια,18 11 2009
τηνκυριακη στις σερρες η ντορα μπακογιαννη,14 11 2009
το 16ο συνεδριο ποντιακων συλλογων στις σερρες το φθινοπωρο του 2010,04 11 2009
το 50ο φεστιβαλ θεσσαλονικης στις σερρες,18 11 2009
το εβες στην 1η εμποροβιοτεχνικη εκθεση πιεριας,04 11 2009
το προγραμμα των αγωνων της επς σερρων,06 11 2009
το σαββατο εγκαινια εκθεσης για τη ζωη και το εργο του γιαννη ριτσου,25 11 2009
το φεστιβαλ θεσσαλονικης ερχεται στις σερρες,30 11 2009
τον τυφλωσε ο ερωτας και κοντεψε να γινει φονιας,10 11 2009
τουρκοι στις σερρες για πολιτιστικη συνεργασια,11 11 2009
υλοποιηση προγραμματος κοινωνια συμμετεχω,03 11 2009
υποψηφιοι αρχηγοι της νδ δινουν εξετασεις μπροστα στους συνεδρους,07 11 2009
φαρσα για βομβα στο δικαστικο μεγαρο σερρων,13 11 2009
φιλικο οδυσσεα αναγεννησης πανσερραϊκου,25 11 2009
φιλοξενια παιδιων στις σερρες απο τον ελληνικο ερυθρο σταυρο,06 11 2009
χορηγηση επιδοματος αλληλεγγυης αποφασισε χτες η κυβερνηση,04 11 2009
χρυσαφης αλεκος στηριζω ντορα,24 11 2009
χωρις αυξησεις για δευτερη χρονια,20 11 2009
ψωμιαδης παναγιωτης στις σερρες,30 11 2009
ψωμιαδης παναγιωτης την παρασκευη στο νομο σερρων,26 11 2009
αρθρα,ημερομηνία
