0,1
outputs short circuit protected,faqs raqs
cmos drivers clock devices complementary,faqs raqs
can i get two clock outputs from ad9540,faqs raqs
can i run cmos outputs 5v,faqs raqs
can i shift threshold clocks single ended inputs,faqs raqs
can i tri state ad9510 outputs,faqs raqs
can i use different power supply voltages pecl output drivers,faqs raqs
can i use 951x clocks drive mixer rf lo,faqs raqs
do vcxos have better phase noise jitter performance than vcos,faqs raqs
do different divide ratios cause variations jitter,faqs raqs
do divide ratios change propagation delay,faqs raqs
do you guarantee performance shown adisimclk,faqs raqs
does jitter vary different clock frequencies how about phase noise,faqs raqs
does ad9510 support 2.5v pecl,faqs raqs
does fine delay adjust affect jitter,faqs raqs
help my pll came unlocked over temperature,faqs raqs
how can i determine die temperature your device,faqs raqs
how do i choose between active passive filter pll loop,faqs raqs
how do i determine vco good enough my purpose,faqs raqs
how do i feed single ended signal differential input,faqs raqs
how do i get two ad951x pll synchronize same reference input edge,faqs raqs
how do i know which vco work best ad9510,faqs raqs
how do i optimize my pll loop best phase noise jitter,faqs raqs
how do i synchronize multiple clock devices,faqs raqs
how do i use vco supply greater than 5v,faqs raqs
how do i use clock part jitter clean up,faqs raqs
how do harmonic spurs output spectrum affect jitter random deterministic,faqs raqs
how do plls ad951x parts compare other adi plls,faqs raqs
how do you determine bandwidth over which phase noise integrated obtain jitter,faqs raqs
how do you specify jitter,faqs raqs
how does clock clean up function ad951x parts work,faqs raqs
how good does my input signal need,faqs raqs
how long does take pll lock,faqs raqs
how much bandwidth required process pecl lvds output,faqs raqs
i am using clk1 input ad9510 can i just leave floating,faqs raqs
i changed coarse phase adjust evaluation software nothing happened what's going,faqs raqs
i have input present clock input i'm seeing output,faqs raqs
i have pulled syncb low i still have output from channel why,faqs raqs
i turned off my reference digital lock detect dld still says i'm locked,faqs raqs
i want use variable delay adjust jitter too high what can i do,faqs raqs
i'm working optical networks sonet sdh do adi's clock chips support applications,faqs raqs
i change level pecl output does affect jitter,faqs raqs
01 uf sufficient power supply pin bypass,faqs raqs
okay ac couple pecl lvds outputs,faqs raqs
possible impedance match clock output heavily loaded e.g cl 100pf,faqs raqs
way cause input output rising edges synchronous zero delay ad9510 11,faqs raqs
advantage running higher vco frequency than output frequency,faqs raqs
may i use ad9540 spread spectrum clocking,faqs raqs
my loop locking how do i debug,faqs raqs
ad9510 what relationship between clock output jitter clk1 clk2 input slew rate,faqs raqs
ad951x clock ics does phase offset coarse delay affect jitter,faqs raqs
raqs index,rarely asked questions
rf source booklet pdf 4353 kb rf ic product overview version p 02 2014,обзор
should i reference passive filter ground supply,faqs raqs
should i tie my loop filter ground pll supply,faqs raqs
should i use minimum charge pump current settings order minimize power,faqs raqs
loop filter working great until i changed divide ratio pll what happened,faqs raqs
ug 476 pll software installation guide pdf 520 kb,руководства пользователей
using adc snr method what equivalent bandwidth jitter specification,faqs raqs
what some advantages disadvantages using lvpecl vs lvds outputs,faqs raqs
what best clock sources distribution only design,faqs raqs
what clock frequency comes out ad9510 outputs when you first apply power device,faqs raqs
what happens i run part ambient environment which exceeds 85 c,faqs raqs
what happens ad9510 11 clock outputs reference input refin signal goes away,faqs raqs
what pll synthesizers how used,faqs raqs
what best way terminate lvpecl outputs get lowest jitter,faqs raqs
what difference between coarse phase adjust fine delay adjust,faqs raqs
what fan out capability cmos lvds lvpecl outputs,faqs raqs
what fine delay adjust which available certain lvds cmos outputs,faqs raqs
what proper termination value location outputs,faqs raqs
what should i do unused channels ad9510,faqs raqs
what suppliers do you recommend vco vcxos,faqs raqs
what's advantage dds based clock generator,faqs raqs
when jitter number specified without associated bandwidth what bandwidth should assumed,faqs raqs
who do i contact technical support adisimclk,faqs raqs
why can i get same output amplitude rise fall times stated your datasheet,faqs raqs
why can't i use bandpass filter my loop filter,faqs raqs
why do i see reference spurs,faqs raqs
why do i want run fast pfd frequency,faqs raqs
why do you recommend ac coupling rather than dc coupling clock inputs,faqs raqs
why doesn't pll make my reference input clock outputs line up,faqs raqs
why doesn't mini divider support divide ratio i want,faqs raqs
why don't you spec psrr cmrr datasheet,faqs raqs
why my phase noise shape changing when i change pll settings,faqs raqs
why fine delay adjust available all outputs,faqs raqs
why should i use differential rather than single ended,faqs raqs
differential single ended inputs outputs improve my jitter,faqs raqs
ad9510 work without reference input signal,faqs raqs
наименование,тип контента
словарь терминов,глоссарий
