4,3
auf dem franz lenze platz im herzen des duisburger stadtteils vierlinden erleben sie jede woche einen bunten vielfltigen wochenmarkt unsere marktbeschicker bieten ihnen eine groe auswahl waren des tgl,duisburg
mitten im herzen des duisburger stadtteils aldenrade und unmittelbarer nhe zum walsumer bezirksamt ist der wochenmarkt als einkaufsquelle und natrlich auch als treffpunkt fr die bewohnerinnen und bewo,duisburg
im quirligen stadtteil marxloh erleben sie 3 mal jeder woche einen bunten und vielfltigen wochenmarkt auf dem multikulturellen wochenmarkt gibt es immer wieder spannende angebote zu entdecken,duisburg
auf dem neumhler wochenmarkt stehen die frischen produkte wie obst und gemse kartoffeln wurst und fleisch fisch backwaren und eier aber auch blumen und pflanzen hufig unmittelbar vom erzeuger im mitte,duisburg
auf dem grten wochenmarkt nordrhein westfalen warten gut ca 1 200 m warenprsentation von mehr als 150 hndlern auf sie hier finden sie alles das herz begehrt,duisburg
mitten im herzen des multi kulti stadtteils bruckhausen erleben sie immer freitags einen bunten und quirligen wochenmarkt als ganztagesmarkt versorgt er auch jeden kunden der nach feierabend seine woc,duisburg
das lebendige treiben auf dem wochenmarkt beeck ist nicht nur sympathisch es bietet zudem alles sie fr den tglichen bedarf bentigen,duisburg
die produktpalette der sympathischen hndler auf dem wochenmarkt laar ist weit gefchert und lsst kaum wnsche offen neben obst und gemse wurst fleisch und fisch finden sie hier auch anbieter von frische,duisburg
auf dem wochenmarkt untermeiderich finden sie neben leckerem obst und knackigem gemse frisches fleisch und deftige wurstwaren blumen textilien auch neuigkeiten aus der nachbarschaft das preis leistung,duisburg
unmittelbar einer der schnsten fugngerzonen duisburgs wird ihnen 2 mal jeder woche ein umfangreiches sortiment aus obst gemse kartoffeln wurst und fleisch eier fisch und backwaren aber auch blumen und,duisburg
immer wieder samstags erwartet sie der multi kulturelle wochenmarkt auf der wasgaustrae mit einem bunt gemischten warenangebot als einkaufsquelle und natrlich auch als treffpunkt fr die bewohnerinnen ,duisburg
entdecken sie jede woche einen kleinen aber feinen wochenmarkt im herzen des weltberhmten hafenstadtteils ruhrort einer der schnsten pltze duisburgs lockt nicht nur die bewohner des stadtteils sondern,duisburg
auf dem bismarckplatz im herzen des stadtteils homberg hier erleben sie jede woche einen bunten und vielfltigen wochenmarkt unsere marktbeschicker bieten ihnen eine berzeugende auswahl waren des tglic,duisburg
auf dem wochenmarkt hochheide stimmt das preis leistungsverhltnis ebenso wie die frische und menschliche art der hndler berzeugen sie sich vom frischen angebot des hochheider wochenmarktes da darfs au,duisburg
mitten im herzen des duisburger stadtteils rumeln erwartet sie jeden donnerstag ein wahres einkaufserlebnis auf dem bunten und geselligen wochenmarkt sind vielerlei frische waren freundliche hndler un,duisburg
der schnittstelle von kaiser und kronprinzenstrae friemersheim finden sie einen vielfltigen wochenmarkt das angebot hat es sich ob frisches obst und gemse textilien haushalts oder geschenkartikel frie,duisburg
auf dem wochenmarkt bergheim herrscht zweimal die woche buntes und lebendiges treiben wenn obst gemse backwaren fleisch fisch kse oder blumen den besitzer wechseln,duisburg
der wochenmarkt hochemmerich wurde 2013 zum schnsten wochenmarkt nrw gekrt und das aus gutem grunde das umfangreiche angebot waren aller art und die charmanten hndler machen den einkauf zu einem wahre,duisburg
der wochenmarkt auf der knigsberger allee ist dank seines vielfltigen sortiments und der besonders arbeitnehmerfreundlichen ffnungszeiten als einkaufsquelle und als treffpunkt fr die bewohner duissern,duisburg
der wochenmarkt auf dem ludgeriplatz ganz der nhe des duisburger hauptbahnhofs bietet ein breit gefchertes sortiment waren aller art natrlich stehen die frischen produkte wie obst und gemse kartoffeln,duisburg
der bauernmarkt der duisburger innenstadt ist mittlerweile eine feste institution 1996 wurde er als reiner erzeugermarkt ins leben gerufen das konzept erzeuger aus dem umland mit ihren waren mitten di,duisburg
der wochenmarkt hochfeld begeistert mit seiner basar hnlichen atmosphre jeden mittwoch und samstag die zahlreichen besucher hier findet man fast alles das herz begehrt von knackigem obst und gemse ber,duisburg
der wochenmarkt auf dem michaelplatz berzeugt seine zahlreichen besucher mit seinem breiten sortiment und seiner tollen atmosphre auf 700 meter warenprsentation finden sie ganz sicher das richtige,duisburg
der wochenmarkt bissingheim dient als exzellente einkaufsquelle und sympathischer treffpunkt zum plaudern die hndler sind immer donnerstags auf dem dorfplatz fr sie da,duisburg
auf dem wochenmarkt wedau versprt man eine gemtliche atmosphre die zum verweilen einldt wer die waren des tglichen bedarfs ganz entspannt einkaufen mchte ist hier genau richtig,duisburg
der charmante markt dem freundlichen stadtteil buchholz begeistert immer wieder mit seinem tollen sortiment nicht nur die waren sondern vor allem die menschen machen diesen markt so einzigartig,duisburg
der wanheimer wochenmarkt berzeugt mit seinem reichhaltigen angebot frischen waren genau der richtige ort fr alle die neben den frischen waren des tglichen bedarfs auch noch die frischesten neuigkeite,duisburg
gesundes obst und knackiges gemse frisches fleisch und deftige wurstwaren fisch blumen und textilien finden sie auf dem wochenmarkt huckingen genauso wie ein ausgewogenes preis leistungsverhltnis und ,duisburg
