4,3
atherectomy device,devices vascular intervention inc
annular bone saw,edwin j greenfield
reenforced tubing,moschelle judson d
double cutting biopsy bistoury,sklar mfg co inc j
drills clearing obstructions arteries,nat res dev
embolectomy catheter,clark iii william t
rotary biopsy device method using same,shelby m baylis
biopsy device,david s pratt
counter rotating biopsy needle,matthews larry s
method apparatus removal enclosed abnormal deposits,auth david c
double lumen dilatation catheter,thomas j fogarty
method apparatus surgically removing remote deposits,intravascular surgical instruments inc
angioplasty catheter method use thereof,innoventions biomedical inc
plaque softening method,cordis corporation
